{
  "bundle_version": "1",
  "subject": "https://example.com",
  "payload_sha512": "29f69318dcc7524c815d8914954cad25fd3deb4c99853304a454f730d7ca4379cb9f9becbbc0dbc0ec4064507bddab6e053076471f71ec0f9eb020770f201188",
  "created": "2026-07-21T12:00:00Z",
  "key_epoch": 1,
  "policy_id": "tfws.hybrid.baseline.v1",
  "signatures": [
    {
      "algorithm": "ed25519",
      "key_id": "release-1",
      "public_key_uri": "/.well-known/keys/ed25519.pem",
      "value": "3zVuDvvsYOHqXjtixiRwaJnby7uDqeF/4pZSAsh1n8McEg1XhEPIoPGoYB+xxIhGKio9Lsd+E4dlLJ/PsKXcBA=="
    },
    {
      "algorithm": "ml-dsa-65",
      "key_id": "release-1",
      "public_key_uri": "/.well-known/keys/ml-dsa-65.pem",
      "value": "te8J3+90efzcPq4S+Q2FVAMAag7jjqs8/xbGuGpqHgxS4tcjcOekwnC19YPOlIhi7a0WvJUgb2kwn18xK/p9601Dk06z8DUg4J7h1eigCXA6oKqWOQFurO2Kcv2Mu7RZJ03d8yvgdwH0pGqH+upjXgub/Ttu7nGVr06YIgjfbfp1X1iEV8yA57pe9ktKXYiqheAiwHPUdDjisGeEyK4fUR3BgwQtmF6KfUnlo0LWt9RlF/rkX4LdujlWs03Avb8dzeElWnqt5pueNVNqfST346IpQSYRhteefRsHj+qtEHICIBQ5dV70euDiwSw8MGMuUP/PBVltDfbgXPquZt4ceT0fwQFzw6SGJAyod8Bd9+GwnbgG8dlGXoCbiZ4aDqVgLgTUmmcUajdcNMyp437f2fCc7HgOm63tdqjK3J7dpObRsdeAbjj0vYBqrNF3cUt/emiFH9Iz/Uu/xIxqJsQAHnG1/EyTqQjhWmeznmxc01sirG434nWVfmP5HqacYgBQr+COm10UJoCk1/8cKfkJ2GP87gaA5i1aIfY5YKu3EJY6rgezUYsn0bIvWaxx7+RTLyp66FWYj1FqzR5HcLdavfoQyFZDGOBFTMiTM9E6Ow7hLYrRSpzJVihVpBA7ddRMsvT90bdYpipw1QlE74Q1HDTvgirJbWMwd6VIZkfv3Obwy5TAd5lS7156IaEcnif1ILVjocNmM1/YJyIr8uznCyKFOU5EnnHItsU6ilCpzKVsHTr1Vs13+5e4jvodLIZ4YIpr0w32ekubJKBSCKpkTzHUb98Uw1So7809qUDKbpULldKabQ9A3zQunvb8oZrrM/O0m7NPfIIBTphYp0gLYaGWaWMJfA0ZKnMKx/aCe7tjTnN4OxkNGsw9TCyGKcefARPfFKwWjLOYaB0oN1i1uiYxupapM4Fh42j7AIGOj8l+MCkueLem03C0bOXK7qRbpBR8e/9lkidXjLP36NhKnXPVLQRKHKU1QjZrF+9+7GNPVNzki61dxBz8ky7JVGgkyWVXHWrG7VMwxY1G5sdEdd3ULY/9EZ7PjenxlidWVi4ZeUQc/+zfzoyhoryr3Xag8+S25J5u92/j+1aLuzZY9qCgvyK+BFx27rDelVg7UAl1eIZKGcKlNidaidIdUZXrfWmwisXl+lu9PF8J/KG2FfIOE+bSMMEL0wxOcL/IrzG6dSk7wWU8w87HQXzo1csH4/suJ9OTDzK9coGQLN+bmysVIGTn/hvN1sVZi2EG/gjRLOZjdIszlFnbfaOUKc5jUzmRr2fQGZykXiZk7TIpMJRrkf1g1hW/3peXwhkXJVAUH/VpdykSjc+VV+0fqW1saLiNz7fz5PXFuxOtQdThsml/j/FzapuhQYOaBULT0d+QMnxdLr+nYlzV0CYC+XcoVHNEmhrREpSmkifeG+YYvteOnhwYeqgHBrWklVXcGZwlAN5iw+f4Idedg/3wwV1uVd727c0krsDE2N4WoKLUaOsH1ov5/kog3Mj7FYmPei8DkoLEcFFOx+SBoU7On9LNIP8H6UCYE7+x5nNi4ZE+2CXGpOa1NQzlY2PpP+S/6+2MaWv8qe6J24NXAHjihLXRWehxtJP30dk5EbLjKVOFcR6QEAX09oqTKVyxZMSbbusH9FccPsNAkmQf55g8/2m82qvDAxEq4ZHAa83Sf6xMpJOc0WS+qY4XAb/xuopz8dz+Dcns8VYjyPH3IORpSw0fhv4SCSkpWqOo7fimL3hcZYqrA6c2y8BLeAIiKnbiWkPmZACkrLTO+6avOtpYB1mGoU5vow+fIZzrIcXbNWOAz9mPBjigpMgbj24MCsQz2xvySHrQZvh2ZwcITGKgeua44kmDP8cyZ+YzW21s1zhVNDDs/QLXYTZgBbPmexcJEvNvEFL/glFuQQEiKMtOWiTgd7gOZSouWUVQQFqRCOGuM/Ky4XSbhwpEA38YZH9ZhvNXg6lSrvaq85fKG/KTnUD9TTyQfIimX8+y9v3SuRNivtUh1ENNABaVoIQ8HGzBST2KFVcY+DMaLv6SzUxCUbp3Ibdr+7qel9SFhfGfPziPC/n83I5vKi4u/8o8kVZ9+K9VATBWsacPay0UHAZVjYQOUIQX24nPnNsCP1w0rM8Sd6S9ABUQiYtMMtVi4Rd0fi8xcloejrabbwXZsNtJNligMPR8asvRRJPgdxu3Fwo207bXA0d4xWqeC5hwupdEe8lZo7JSHPUeWO/tlzeQ/uxMZD2qTcYOEZw4otUd4euX4X6M26/auk+auTLHgiHSla9n1AYzszjO2qAOwaTNfUC13AZ7XHGU8IcBRC406nB4Kp7R/kN7K2YfPNPeTLjaYXtoTmlggRy9KVHUY/MOwerWaKZrkj99b0tQ3HJhCNbQM9DSCWGVp3iwuIDBjswdnAhsG1UzcTRb9KROFi3j498CjytsshW8lEOzgin2QNFEQR00m4rCBSZupyiAqi1kOGd8g/W8DRYtRO3jblIugKAoAZSmn9ToPAdQ1ra91MycVE6DosPtZOvRP9qFBn98wNm3oY+6gGsKtPURAXHetGKTHxOdSIJO4+yK43416fuvL3vfEzbwsbDvZbpDdlZVmlCqZ9/vSiwxxELw5C6fBtC8L33Jla4+tvyoKq2Fy6+iDcKg1Ns29HZh+NvK6YvQ8Nve++ZlHzjbvrus777camuiuCfV94v0X8x2ht+UuhPsF2/yQ77R+l3MJGK2Mdm+KlXpHR0s+X6Fanle2u2mRc123uiJC6ur7HKKLwmMR6MY78Eq9/QdWtfXoW+3FNzRvLd2mNPcfJNzeToMdX/sTUbQEIaRML3UoXOESJvoqXI+Y9cWRJ47fjxk5iNnZ/du6GNyxdqbfYanOsHNVZqMjhFW5b/Nv0Bf+Dan5JI+cnoxVOdis2uoU5YOeVGCCOn02VhhkqQi2pGp9wGYTk+sWkt6jHBJAoMWR4XHs+X+OGn21m3NSPzAMG2SrIUboEcincGn6wKadkeznAUF6+x5qnD/sHelCLHN0TB0YXcOXfzP5UnQ7w+wuHPrpLgqmw0Kde8yigEo+u6XN9wx6oY/5WREw+paDysi2JXJfA0tUZgOUojekjEHs+2Rzvx/QNe0KqNLmNeRKtlNzOHuWuj+h78mvIsZc93hAYWzvGuhvKiIWKshWa2czsv7WpTOkrIyuI0y3GS7xP20Zq1zhWzFNwLP8xWExwSqAPo/i/D15nBC803VZdn/D0EyvC8qUvd3rwbrmQMHurYZjLU5cdMfkHQtIAGcOYwabTjpTSv7kQbtIScRNQ4GYM5e858zFgGB1SXOhOoNHw3AAGdSHdLyMYyHvF6cLilT1PD7ZMJVjQx0BHj4t45Dp2z/SDYSLbcniSqvBb8Xk0TqiqiKtFRpKQsI3RMzdTpqWzIR6Rqpob4HXyD7X8Iv1EUILIbQ+xT4+o7omziOJQwoquS/L+y9tVFDWz2O+XQPVzYeX79m8b7IbAZCvqKOKgMTW6TnZrVcr5sz25xkmNxSpLikZI3KRcUQEDJeciltz4eBmH9qfpnhzx2vSC3sG1x09Gb/iLammC0IqLdAQJQg8YNaKmguzoRYP5M7IVrZwt7mrMcReHvTuHqoqhUne1M+RLhlCjP6iBPWXzdxiVf0Q4B5jNvF1BRjbrzgR89XAtEoyRyLyVN78mN9mnMyTyNf2y79/dHcPRkzUYdW2bh+wokbgi+S2w4LYxdVVaJN57vT7fjk/JRci+aNiejXlwpgzkPQTD2S7Eyf7LdWff/4qAXZqoNy8jpivL0LBvJJziBHkTsPP6eZb4OU9a7ZJqTEScyPg4ajP87HJmj55fFdHlRyTdA+J8pg2095pXfpDFW6hTM8fMGy8+8OE3prGJ+Jegc77rbBEz1mlUlOUbKnb6K0unzzvbCEw75jodg27QRBNYUm2AH3iCRu8Kkc3cvJ0NvXBkFcOx079JgVURYHXvd06Y5UB/cQHMnyXZ7bhPOZmoEpCxfVjFDu3vwg4ep5KF+op2xrR1ZfI44qzxBBsAM6JhYNz6A/MKawexIkNTc1182eVTh3tEWGndgQjVrAUP66JNfdp28ys0T8XA3ZpOO8p4UBvHhvkCL8QFlZf3LanPHnfrlJQ1Zi+wfkavZRyaFLyS7Ktst7eTGIuprYOzpM8mlkYR0Aq72q/Qn9ltq3kCiJiKvEnakh8dyP0D3Ex+FiQe+pjGvDnELSKNcZMvbIhY/klXYnramSJE4qW2U5JaUcfzgPQXAo97dHsetHXJdPS1IYPKyH3c7nCG3o9Tvk1N1YMaVBNOuu0ZwgoT03z5+k/12SriJhL/fYWC4NAQxeG0j7dFYCKS3U8vckN1Rxx/kaR2Z9l+oOL0yt3OD5JmWCsOr7AiZQVYLoAAAAAAAAAAAAAAAAAAAAAAAABgwSGR8l"
    }
  ]
}
